{
  "id": "V-E042-endgame-3S-vs-KH2DKD-drawOpponent",
  "version": "1.0.0",
  "title": "two-player endgame 3S against KH 2D KD (drawOpponent)",
  "rules": [
    "R37",
    "R40",
    "R41",
    "E14"
  ],
  "setup": {
    "hands": [
      [
        "3S"
      ],
      [
        "KH",
        "2D",
        "KD"
      ]
    ],
    "leader": 0,
    "discard": [],
    "rules": {
      "twoPlayerEndgame": "drawOpponent",
      "confirmedFastForward": false
    }
  },
  "moves": [],
  "assert": {
    "forcedBhabhi": null,
    "stateHash": "a800354360244e4f4c3d07999dec6a6dc59579f1dfb77a3821ea6f72bfbb8c76"
  }
}
