{
  "id": "V-E115-endgame-3S9S-vs-KH2D-drawDiscard",
  "version": "1.0.0",
  "title": "two-player endgame 3S 9S against KH 2D (drawDiscard)",
  "rules": [
    "R37",
    "R40",
    "R41",
    "E14"
  ],
  "setup": {
    "hands": [
      [
        "3S",
        "9S"
      ],
      [
        "KH",
        "2D"
      ]
    ],
    "leader": 0,
    "discard": [
      "4C",
      "5C"
    ],
    "rules": {
      "twoPlayerEndgame": "drawDiscard",
      "confirmedFastForward": false
    }
  },
  "moves": [],
  "assert": {
    "forcedBhabhi": 0,
    "stateHash": "c4ac04bfaf5bb877a9d43f26440ccbfc151555473a55784dc6ba58b9bb89dbcf"
  }
}
