{
  "id": "V-E089-endgame-9SKH-vs-2D-thullaEndsRound",
  "version": "1.0.0",
  "title": "two-player endgame 9S KH against 2D (thullaEndsRound)",
  "rules": [
    "R37",
    "R40",
    "R41",
    "E14"
  ],
  "setup": {
    "hands": [
      [
        "9S",
        "KH"
      ],
      [
        "2D"
      ]
    ],
    "leader": 0,
    "discard": [],
    "rules": {
      "twoPlayerEndgame": "thullaEndsRound",
      "confirmedFastForward": false
    }
  },
  "moves": [],
  "assert": {
    "forcedBhabhi": 0,
    "stateHash": "e260b681ffbbba529c517d33f0e983edd1af71a4b2984859af2af5a158f49663"
  }
}
