{
  "id": "V-E094-endgame-KH2D-vs-9S-drawDiscard",
  "version": "1.0.0",
  "title": "two-player endgame KH 2D against 9S (drawDiscard)",
  "rules": [
    "R37",
    "R40",
    "R41",
    "E14"
  ],
  "setup": {
    "hands": [
      [
        "KH",
        "2D"
      ],
      [
        "9S"
      ]
    ],
    "leader": 0,
    "discard": [
      "4C",
      "5C"
    ],
    "rules": {
      "twoPlayerEndgame": "drawDiscard",
      "confirmedFastForward": false
    }
  },
  "moves": [],
  "assert": {
    "forcedBhabhi": 0,
    "stateHash": "ca2595095e1f9776f7f2e7ecbff96ca081cfc0f3d9f0dcba64e0101f8107d226"
  }
}
