{
  "id": "V-E110-endgame-2SKD-vs-7SKH-thullaEndsRound",
  "version": "1.0.0",
  "title": "two-player endgame 2S KD against 7S KH (thullaEndsRound)",
  "rules": [
    "R37",
    "R40",
    "R41",
    "E14"
  ],
  "setup": {
    "hands": [
      [
        "2S",
        "KD"
      ],
      [
        "7S",
        "KH"
      ]
    ],
    "leader": 0,
    "discard": [],
    "rules": {
      "twoPlayerEndgame": "thullaEndsRound",
      "confirmedFastForward": false
    }
  },
  "moves": [],
  "assert": {
    "forcedBhabhi": null,
    "stateHash": "919d59875435819c28a7bc80382675bea9d675f6a14039ff19d0fd030cdf7b0e"
  }
}
