{
  "id": "V-E050-endgame-9S-vs-3SQH2D-thullaEndsRound",
  "version": "1.0.0",
  "title": "two-player endgame 9S against 3S QH 2D (thullaEndsRound)",
  "rules": [
    "R37",
    "R40",
    "R41",
    "E14"
  ],
  "setup": {
    "hands": [
      [
        "9S"
      ],
      [
        "3S",
        "QH",
        "2D"
      ]
    ],
    "leader": 0,
    "discard": [],
    "rules": {
      "twoPlayerEndgame": "thullaEndsRound",
      "confirmedFastForward": false
    }
  },
  "moves": [],
  "assert": {
    "forcedBhabhi": 0,
    "stateHash": "6fb923cd99414a59e8df4437fbe5a567852159158765e5f79d9c39ce74c2a05e"
  }
}
