{
  "id": "V-E063-endgame-2D-vs-2S7SQH-drawOpponent",
  "version": "1.0.0",
  "title": "two-player endgame 2D against 2S 7S QH (drawOpponent)",
  "rules": [
    "R37",
    "R40",
    "R41",
    "E14"
  ],
  "setup": {
    "hands": [
      [
        "2D"
      ],
      [
        "2S",
        "7S",
        "QH"
      ]
    ],
    "leader": 0,
    "discard": [],
    "rules": {
      "twoPlayerEndgame": "drawOpponent",
      "confirmedFastForward": false
    }
  },
  "moves": [],
  "assert": {
    "forcedBhabhi": null,
    "stateHash": "f83772e260f9d3b4f5d4675a54240c323f4fead97934786d48965e671a971cbc"
  }
}
